{
  "$schema": "https://json-schema.org/draft/2020-12/schema",
  "$id": "https://obsidian.local/schemas/micp-evidence-extractor.input.json",
  "title": "MICP Evidence Extractor — Input Contract",
  "description": "Strict input contract for the micp-evidence-extractor skill (MEE). Every required field is mandatory; missing required fields MUST be reported with explicit field names, why they are critical, and how to obtain them. The document to extract evidence from arrives as `document` (structured JSON: metadata + sections + tables + figures) or as `document_text` (plain text; parsed into sections by the adapters tool). Version 1.0.0.",
  "type": "object",
  "additionalProperties": false,
  "required": [
    "task_id",
    "project_id",
    "request",
    "skill_version",
    "controller_version",
    "timestamp"
  ],
  "properties": {
    "task_id": {
      "type": "string",
      "minLength": 1,
      "maxLength": 128,
      "pattern": "^[A-Za-z0-9][A-Za-z0-9._:-]*$"
    },
    "project_id": {
      "type": "string",
      "minLength": 1,
      "maxLength": 128,
      "pattern": "^[A-Za-z0-9][A-Za-z0-9._:-]*$"
    },
    "request": {
      "type": "string",
      "minLength": 1,
      "maxLength": 20000,
      "description": "The natural-language extraction request (must state a deliverable and name the MICP focus)."
    },
    "skill_version": {
      "type": "string",
      "pattern": "^\\d+\\.\\d+\\.\\d+$"
    },
    "controller_version": {
      "type": "string",
      "pattern": "^[A-Za-z0-9][A-Za-z0-9._:\\-]*$"
    },
    "timestamp": {
      "type": "string",
      "pattern": "^\\d{4}-\\d{2}-\\d{2}T\\d{2}:\\d{2}:\\d{2}"
    },
    "document": {
      "$ref": "#/$defs/document"
    },
    "document_text": {
      "type": "string",
      "maxLength": 2000000,
      "description": "Plain text of the source (pdf/text/markdown extraction result). Either document or document_text must be present."
    },
    "source_path": {
      "type": "string",
      "maxLength": 2000,
      "description": "Path to the source file (pdf/html/md/csv). The adapters tool reads it when document/document_text are absent."
    },
    "evidence_refs": {
      "type": "array",
      "maxItems": 500,
      "items": {
        "$ref": "#/$defs/ref"
      }
    },
    "data_refs": {
      "type": "array",
      "maxItems": 500,
      "items": {
        "$ref": "#/$defs/ref"
      }
    },
    "upstream_outputs": {
      "type": "array",
      "maxItems": 200,
      "items": {
        "$ref": "#/$defs/upstreamOutput"
      }
    },
    "context": {
      "type": "object",
      "additionalProperties": true,
      "properties": {
        "task_graph": {
          "type": "object"
        },
        "memory_refs": {
          "type": "array",
          "items": {
            "type": "object"
          }
        },
        "call_chain": {
          "type": "array",
          "items": {
            "type": "string"
          }
        },
        "completed_calls": {
          "type": "array",
          "items": {
            "type": "object"
          }
        },
        "prior_decisions": {
          "type": "array",
          "items": {
            "type": "object"
          }
        },
        "environment": {
          "type": "object",
          "properties": {
            "workspace": {
              "type": "string"
            },
            "offline": {
              "type": "boolean"
            }
          },
          "additionalProperties": true
        },
        "knowledge_base_refs": {
          "type": "array",
          "items": {
            "type": "object"
          }
        }
      }
    },
    "constraints": {
      "type": "object",
      "additionalProperties": true,
      "properties": {
        "max_cards": {
          "type": "integer",
          "minimum": 1,
          "maximum": 5000
        },
        "require_doi_check": {
          "type": "boolean"
        },
        "allowed_acquisition_modes": {
          "type": "array",
          "items": {
            "type": "string",
            "enum": [
              "REPORTED_TEXT",
              "REPORTED_TABLE",
              "DIGITIZED_FROM_FIGURE",
              "CALCULATED_FROM_REPORTED_DATA",
              "INFERRED",
              "NOT_REPORTED",
              "AMBIGUOUS"
            ]
          }
        },
        "allow_figure_digitization": {
          "type": "boolean",
          "default": true
        },
        "offline": {
          "type": "boolean",
          "default": true
        }
      }
    },
    "requested_output_format": {
      "type": "string",
      "enum": [
        "json",
        "markdown+json"
      ]
    },
    "risk_level": {
      "type": "string",
      "enum": [
        "low",
        "medium",
        "high",
        "critical"
      ]
    },
    "human_approval_state": {
      "type": "string",
      "enum": [
        "not_required",
        "pending",
        "approved",
        "rejected"
      ]
    },
    "reproducibility": {
      "type": "object",
      "additionalProperties": true,
      "properties": {
        "random_seed": {
          "type": "integer"
        },
        "input_fingerprint": {
          "type": "string"
        }
      }
    }
  },
  "$defs": {
    "ref": {
      "type": "object",
      "additionalProperties": false,
      "required": [
        "ref_id",
        "locator"
      ],
      "properties": {
        "ref_id": {
          "type": "string",
          "minLength": 1,
          "maxLength": 128
        },
        "locator": {
          "type": "string",
          "minLength": 1,
          "maxLength": 2000
        },
        "media_type": {
          "type": "string",
          "maxLength": 128
        },
        "note": {
          "type": "string",
          "maxLength": 2000
        }
      }
    },
    "upstreamOutput": {
      "type": "object",
      "additionalProperties": false,
      "required": [
        "skill",
        "task_node",
        "output"
      ],
      "properties": {
        "skill": {
          "type": "string",
          "minLength": 1,
          "maxLength": 128
        },
        "task_node": {
          "type": "string",
          "minLength": 1,
          "maxLength": 128
        },
        "summary": {
          "type": "string",
          "maxLength": 4000
        },
        "output": {
          "type": "object"
        }
      }
    },
    "section": {
      "type": "object",
      "additionalProperties": false,
      "required": [
        "kind",
        "text"
      ],
      "properties": {
        "kind": {
          "type": "string",
          "enum": [
            "abstract",
            "methods",
            "results",
            "discussion",
            "conclusion",
            "supplementary",
            "other"
          ]
        },
        "heading": {
          "type": "string",
          "maxLength": 1000
        },
        "text": {
          "type": "string",
          "minLength": 1,
          "maxLength": 2000000
        }
      }
    },
    "table": {
      "type": "object",
      "additionalProperties": false,
      "required": [
        "table_id",
        "caption",
        "rows"
      ],
      "properties": {
        "table_id": {
          "type": "string",
          "minLength": 1,
          "maxLength": 128
        },
        "caption": {
          "type": "string",
          "maxLength": 2000
        },
        "header": {
          "type": "array",
          "items": {
            "type": "string",
            "maxLength": 500
          }
        },
        "rows": {
          "type": "array",
          "minItems": 1,
          "maxItems": 20000,
          "items": {
            "type": "array",
            "items": {
              "type": [
                "string",
                "number",
                "null"
              ],
              "maxLength": 2000
            }
          }
        },
        "source_locator": {
          "type": "string",
          "maxLength": 500
        }
      }
    },
    "figure": {
      "type": "object",
      "additionalProperties": false,
      "required": [
        "figure_id",
        "caption"
      ],
      "properties": {
        "figure_id": {
          "type": "string",
          "minLength": 1,
          "maxLength": 128
        },
        "caption": {
          "type": "string",
          "maxLength": 2000
        },
        "image_path": {
          "type": "string",
          "maxLength": 2000,
          "description": "Path to the raster image for digitization (absolute or workspace-relative)."
        },
        "note": {
          "type": "string",
          "maxLength": 2000
        }
      }
    },
    "document": {
      "type": "object",
      "additionalProperties": false,
      "required": [
        "source_id"
      ],
      "properties": {
        "source_id": {
          "type": "string",
          "minLength": 1,
          "maxLength": 200
        },
        "title": {
          "type": "string",
          "maxLength": 1000
        },
        "authors": {
          "type": "array",
          "items": {
            "type": "string",
            "maxLength": 300
          }
        },
        "year": {
          "type": "string",
          "pattern": "^\\d{4}$"
        },
        "journal": {
          "type": "string",
          "maxLength": 300
        },
        "doi": {
          "type": "string",
          "maxLength": 300
        },
        "document_type": {
          "type": "string",
          "maxLength": 100
        },
        "access_date": {
          "type": "string",
          "pattern": "^\\d{4}-\\d{2}-\\d{2}"
        },
        "fulltext_source": {
          "type": "string",
          "maxLength": 1000
        },
        "sections": {
          "type": "array",
          "maxItems": 2000,
          "items": {
            "$ref": "#/$defs/section"
          }
        },
        "tables": {
          "type": "array",
          "maxItems": 2000,
          "items": {
            "$ref": "#/$defs/table"
          }
        },
        "figures": {
          "type": "array",
          "maxItems": 2000,
          "items": {
            "$ref": "#/$defs/figure"
          }
        },
        "media_type": {
          "type": "string",
          "maxLength": 128,
          "description": "Detected source kind: application/pdf | text/html | text/markdown | text/csv | text/plain | application/json."
        }
      }
    }
  }
}
